### ISSUE TITLE
Remote server refuses longer HTTP POST requests

### ISSUE THREAD

**Issue by lvca** [ArcadeData/arcadedb#760]
### Discussed in https://github.com/ArcadeData/arcadedb/discussions/759

<div type='discussions-op-text'>

<sup>Originally posted by **mik1234mc** January 11, 2023</sup>
Hi all,

my application connects usign Python Request library to ArcadeDB over HTTP API (and SQL). So far, I run the application together with ArcadeDB server on the same machine (debian). Now, I moved the server on a different machine (also debian, same ArcadeDB version). I have an issue with longer HTTP POST commands (>3500B, this is just indicative threshold) exceeding one TCP packet. The server accepts these longer packets usually 2times (after ArcadeDB server reset) and then returns code 400 and { "error" : "Command text is null"}. If I dump a communication between the server(10.21.0.7.2480) and the application (10.21.99.22), I see 2 first correct HTTP requests (starting at 13:04:45.334757 and 13:04:53.625676) and the subsequent HTTP POST requests (starting at 13:04:58.484945) are refused (at 13:04:58.486308) before all the request packets are received. I played with ArcadeDB settings on buffer size and timeout values, but no improvement. Do you have any hints why local deploment works, but remote access only very limited?

```
tcpdump 'tcp port 2480'
tcpdump: verbose output suppressed, use -v[v]... for full protocol decode
listening on tun0, link-type RAW (Raw IP), snapshot length 262144 bytes
13:04:45.306006 IP 10.21.99.22.56974 > 10.21.0.7.2480: Flags [S], seq 2287200538, win 64240, options [mss 1288,sackOK,TS val 231553502 ecr 0,nop,wscale 7], length 0
13:04:45.306026 IP 10.21.0.7.2480 > 10.21.99.22.56974: Flags [S.], seq 3780681345, ack 2287200539, win 65160, options [mss 1460,sackOK,TS val 797755808 ecr 231553502,nop,wscale 7], length 0
13:04:45.334484 IP 10.21.99.22.56974 > 10.21.0.7.2480: Flags [.], ack 1, win 502, options [nop,nop,TS val 231553525 ecr 797755808], length 0
13:04:45.334757 IP 10.21.99.22.56974 > 10.21.0.7.2480: Flags [.], seq 1:1277, ack 1, win 502, options [nop,nop,TS val 231553526 ecr 797755808], length 1276
13:04:45.334781 IP 10.21.0.7.2480 > 10.21.99.22.56974: Flags [.], ack 1277, win 501, options [nop,nop,TS val 797755837 ecr 231553526], length 0
13:04:45.338556 IP 10.21.99.22.56974 > 10.21.0.7.2480: Flags [P.], seq 1277:2553, ack 1, win 502, options [nop,nop,TS val 231553526 ecr 797755808], length 1276
13:04:45.338582 IP 10.21.0.7.2480 > 10.21.99.22.56974: Flags [.], ack 2553, win 494, options [nop,nop,TS val 797755841 ecr 231553526], length 0
13:04:45.342089 IP 10.21.99.22.56974 > 10.21.0.7.2480: Flags [.], seq 2553:3829, ack 1, win 502, options [nop,nop,TS val 231553526 ecr 797755808], length 1276
13:04:45.342110 IP 10.21.0.7.2480 > 10.21.99.22.56974: Flags [.], ack 3829, win 485, options [nop,nop,TS val 797755844 ecr 231553526], length 0
13:04:45.342477 IP 10.21.99.22.56974 > 10.21.0.7.2480: Flags [P.], seq 3829:4743, ack 1, win 502, options [nop,nop,TS val 231553526 ecr 797755808], length 914
13:04:45.342502 IP 10.21.0.7.2480 > 10.21.99.22.56974: Flags [.], ack 4743, win 478, options [nop,nop,TS val 797755845 ecr 231553526], length 0
13:04:45.561882 IP 10.21.0.7.2480 > 10.21.99.22.56974: Flags [P.], seq 1:300, ack 4743, win 501, options [nop,nop,TS val 797756064 ecr 231553526], length 299
13:04:45.591702 IP 10.21.99.22.56974 > 10.21.0.7.2480: Flags [.], ack 300, win 501, options [nop,nop,TS val 231553785 ecr 797756064], length 0
13:04:53.625676 IP 10.21.99.22.56974 > 10.21.0.7.2480: Flags [.], seq 4743:6019, ack 300, win 501, options [nop,nop,TS val 231561807 ecr 797756064], length 1276
13:04:53.625722 IP 10.21.0.7.2480 > 10.21.99.22.56974: Flags [.], ack 6019, win 501, options [nop,nop,TS val 797764128 ecr 231561807], length 0
13:04:53.625778 IP 10.21.99.22.56974 > 10.21.0.7.2480: Flags [P.], seq 6019:7295, ack 300, win 501, options [nop,nop,TS val 231561807 ecr 797756064], length 1276
13:04:53.625790 IP 10.21.0.7.2480 > 10.21.99.22.56974: Flags [.], ack 7295, win 494, options [nop,nop,TS val 797764128 ecr 231561807], length 0
13:04:53.625845 IP 10.21.99.22.56974 > 10.21.0.7.2480: Flags [.], seq 7295:8571, ack 300, win 501, options [nop,nop,TS val 231561807 ecr 797756064], length 1276
13:04:53.625853 IP 10.21.0.7.2480 > 10.21.99.22.56974: Flags [.], ack 8571, win 485, options [nop,nop,TS val 797764128 ecr 231561807], length 0
13:04:53.625908 IP 10.21.99.22.56974 > 10.21.0.7.2480: Flags [P.], seq 8571:9485, ack 300, win 501, options [nop,nop,TS val 231561807 ecr 797756064], length 914
13:04:53.625917 IP 10.21.0.7.2480 > 10.21.99.22.56974: Flags [.], ack 9485, win 478, options [nop,nop,TS val 797764128 ecr 231561807], length 0
13:04:53.631623 IP 10.21.0.7.2480 > 10.21.99.22.56974: Flags [P.], seq 300:599, ack 9485, win 501, options [nop,nop,TS val 797764134 ecr 231561807], length 299
13:04:53.656532 IP 10.21.99.22.56974 > 10.21.0.7.2480: Flags [.], ack 599, win 501, options [nop,nop,TS val 231561851 ecr 797764134], length 0
13:04:58.484945 IP 10.21.99.22.56974 > 10.21.0.7.2480: Flags [.], seq 9485:10761, ack 599, win 501, options [nop,nop,TS val 231566690 ecr 797764134], length 1276
13:04:58.485474 IP 10.21.99.22.56974 > 10.21.0.7.2480: Flags [P.], seq 10761:12037, ack 599, win 501, options [nop,nop,TS val 231566690 ecr 797764134], length 1276
13:04:58.485480 IP 10.21.0.7.2480 > 10.21.99.22.56974: Flags [.], ack 12037, win 501, options [nop,nop,TS val 797768988 ecr 231566690], length 0
13:04:58.486308 IP 10.21.0.7.2480 > 10.21.99.22.56974: Flags [P.], seq 599:775, ack 12037, win 501, options [nop,nop,TS val 797768988 ecr 231566690], length 176
13:04:58.487250 IP 10.21.99.22.56974 > 10.21.0.7.2480: Flags [.], seq 12037:13313, ack 599, win 501, options [nop,nop,TS val 231566690 ecr 797764134], length 1276
13:04:58.487478 IP 10.21.99.22.56974 > 10.21.0.7.2480: Flags [P.], seq 13313:14227, ack 599, win 501, options [nop,nop,TS val 231566690 ecr 797764134], length 914
```</div>

**Comment by lvca** [comment]
It looks like it's a configuration of Undertow (RedHat's WebServer we're using) we can set.

I've just pushed a fix that set the read timeout of Undertow to the configured `GlobalConfiguration.NETWORK_SOCKET_TIMEOUT` that by default is 30secs..

```java
        undertow = Undertow.builder().addHttpListener(portListening, host).setHandler(routes)
            .setSocketOption(Options.READ_TIMEOUT, configuration.getValueAsInteger(GlobalConfiguration.NETWORK_SOCKET_TIMEOUT))
            .setServerOption(SHUTDOWN_TIMEOUT, 1000).build();
        undertow.start();
```

Please let me know if this works for you. I don't have a way to test it directly unless you can come up with a reproducible test case that works in a local network.

**Comment by mik1234mc** [comment]
Thanks for fast action. Unfortunately, no difference.  Is there a way to dump some debug data from Undertow?

**Comment by lvca** [comment]
I found something else. In Arcade Trader we solve this issue by adding this before parsing the request:

```java
e.startBlocking();
```

I've changed the ArcadeDB HTTP Server class by adding this. It's under test to see if breaks existent test cases:

(Class AbstractHandler.java):

```java
  protected String parseRequestPayload(final HttpServerExchange e, final boolean blocking) {
    final StringBuilder result = new StringBuilder();
    if (blocking)
      e.startBlocking();
    e.getRequestReceiver().receiveFullBytes(
        // OK
        (exchange, data) -> result.append(new String(data, DatabaseFactory.getDefaultCharset())),
        // ERROR
        (exchange, err) -> {
          LogManager.instance().log(this, Level.SEVERE, "getFullBytes completed with an error: %s", err, err.getMessage());
          exchange.setStatusCode(500);
          exchange.getResponseSender().send("Invalid Request");
        });
    return result.toString();
  }
```

**Comment by lvca** [comment]
It's in the main branch, I hope this works. Please let me know.

**Comment by lvca** [comment]
Sorry, that was too fast. Some tests break with this setting. I need more time to figure this out, but the issue could be related to this. About dumping undertow logs, not sure if there is an easy way.

**Comment by lvca** [comment]
Ok, I found something in the official docs: https://undertow.io/undertow-docs/undertow-docs-2.0.0/undertow-handler-guide.html#request-lifecycle. In practice, long requests should be dispatched to the worker threads. I'm working into a quick fix after some tests.

**Comment by lvca** [comment]
Ok, tested it on a local network, and seems to work properly. Now all the HTTP commands that parse the body in the requests (JSON) are dispatched to a worker thread that is allowed to block the request to parse the entire body.

Please let me know if this completely fixes the issue.

**Comment by mik1234mc** [comment]
Yes, this change seems to fix the issue! Thank you very much!

I see that the web studio changed significantly in the main branch, some old features (Actions to load adjacent in Graph view) are not there, but this is a different story :).

**Comment by lvca** [comment]
@mik1234mc I'm glad it worked out. That part of the Studio didn't change at all, we're just improving the experience, mostly in the query table, the server panel and clustering. What part was missing?

**Comment by mik1234mc** [comment]
@lvca, I meant the Actions section:
![image](https://user-images.githubusercontent.com/24656413/211909615-6e4eb43b-420a-4f30-abb3-4e6a2b8e20a6.png)

In the main branch, I dont see it:
![image](https://user-images.githubusercontent.com/24656413/211909845-4d9f72e0-e267-45bd-909f-959ef7716f1f.png)

**Comment by lvca** [comment]
@mik1234mc Restored the missing panel, thanks!
